<?xml version="1.0" encoding="UTF-8"?>
<personas xmlns:xsi="http://www.w3.org/2001/XMLSchema-instance" xsi:noNamespaceSchemaLocation="ejercicio4.xsd">
	<persona fecha_nacimiento="1992-02-02">
		<datos>
			<nombre>Paquito</nombre>
			<apellidos>de los claveles</apellidos>
			<dni>12345678A</dni>
		</datos>
		<comentario>Es muy majo</comentario>
	</persona>
	<persona fecha_nacimiento="1993-03-03">
		<datos>
			<nombre>Perico</nombre>
			<apellidos>de los palotes</apellidos>
			<dni>87654321B</dni>
		</datos>
		<comentario>Está en todos sitios</comentario>
	</persona>
	<persona fecha_nacimiento="2019-12-20">
		<datos>
			<nombre>COVID</nombre>
			<apellidos>diecinueve</apellidos>
			<dni>19191919C</dni>
		</datos>
		<comentario>Viene de Wuhan</comentario>
	</persona>
</personas>